<?xml version="1.0" encoding="UTF-8" standalone="yes" ?>

<characters xmlns:xsi="http://www.w3.org/2001/XMLSchema-instance"
            xsi:schemaLocation="schemas/characters.xsd">
<!-- 301 -->
  <character>
    <symbol>嗨</symbol>
    <pinyin>hāi</pinyin>
    <meaning>an exclamation</meaning>
    <note/>
    <radical>口</radical>
    <components>
      <component>口</component>
      <component>海</component>
    </components>
  </character>
  <character>
    <symbol>房</symbol>
    <pinyin>fáng</pinyin>
    <meaning>house; room</meaning>
    <note/>
    <radical>戶</radical>
    <components>
      <component>戶</component>
      <component>方</component>
    </components>
  </character>
  <character>
    <symbol>命</symbol>
    <pinyin>mìng</pinyin>
    <meaning>life; fate</meaning>
    <note/>
    <radical>口</radical>
    <components>
      <component>亼</component>
      <component>叩</component>
    </components>
  </character>
  <character>
    <symbol>且</symbol>
    <pinyin>qiě</pinyin>
    <meaning>moreover; both</meaning>
    <note/>
    <radical>一</radical>
    <components>
      <component>月</component>
      <component>一</component>
    </components>
  </character>
  <character>
    <symbol>向</symbol>
    <pinyin>xiàng</pinyin>
    <meaning>towards; direction</meaning>
    <note/>
    <radical>口</radical>
    <components>
      <component>口</component>
      <component>丶</component>
    </components>
  </character>
  <character>
    <symbol>興</symbol>
    <!-- <symbol>兴</symbol> -->
    <pinyin>xīng</pinyin>
    <meaning>to rise; to flourish</meaning>
    <note/>
    <radical>臼</radical>
    <components>
      <component>臼</component>
      <component>同</component>
      <component>一</component>
      <component>八</component>
    </components>
  </character>
  <character>
    <symbol>球</symbol>
    <pinyin>qiú</pinyin>
    <meaning>ball; sphere</meaning>
    <note/>
    <radical>玉</radical>
    <components>
      <component>王</component>
      <component>求</component>
    </components>
  </character>
  <character>
    <symbol>服</symbol>
    <pinyin>fú</pinyin>
    <meaning>clothes; to serve</meaning>
    <note/>
    <radical>月</radical>
    <components>
      <component>月</component>
    </components>
  </character>
  <character>
    <symbol>入</symbol>
    <pinyin>rù</pinyin>
    <meaning>to enter</meaning>
    <note/>
    <radical>入</radical>
    <components/>
  </character>
  <character>
    <symbol>照</symbol>
    <pinyin>zhào</pinyin>
    <meaning>according to; to shine; photo</meaning>
    <note/>
    <radical>火</radical>
    <components>
      <component>昭</component>
      <component>灬</component>
    </components>
  </character>
<!-- 311 -->
  <character>
    <symbol>提</symbol>
    <pinyin>tí</pinyin>
    <meaning>to lift</meaning>
    <note/>
    <radical>手</radical>
    <components>
      <component>扌</component>
      <component>是</component>
    </components>
  </character>
  <character>
    <symbol>掉</symbol>
    <pinyin>diào</pinyin>
    <meaning>to fall; to lose</meaning>
    <note/>
    <radical>手</radical>
    <components>
      <component>扌</component>
      <component>卓</component>
    </components>
  </character>
  <character>
    <symbol>夫</symbol>
    <pinyin>fū</pinyin>
    <meaning>husband</meaning>
    <note/>
    <radical>大</radical>
    <components>
      <component>人</component>
      <component>二</component>
    </components>
  </character>
  <character>
    <symbol>路</symbol>
    <pinyin>lù</pinyin>
    <meaning>road</meaning>
    <note/>
    <radical>足</radical>
    <components>
      <component>各</component>
    </components>
  </character>
  <character>
    <symbol>演</symbol>
    <pinyin>yǎn</pinyin>
    <meaning>to act; to develop</meaning>
    <note/>
    <radical>水</radical>
    <components>
      <component>氵</component>
      <component>寅</component>
    </components>
  </character>
  <character>
    <symbol>夠</symbol>
    <!-- <symbol>够</symbol> -->
    <pinyin>gòu</pinyin>
    <meaning>to be enough</meaning>
    <note/>
    <radical>夕</radical>
    <components>
      <component>多</component>
      <component>句</component>
    </components>
  </character>
  <character>
    <symbol>日</symbol>
    <pinyin>rì</pinyin>
    <meaning>sun; day</meaning>
    <note>Picture of the sun, which rises every day over the horison.</note>
    <radical>日</radical>
    <components>
      <component>口</component>
      <component>一</component>
    </components>
  </character>
  <character>
    <symbol>案</symbol>
    <pinyin>àn</pinyin>
    <meaning>legal case; record</meaning>
    <note/>
    <radical>木</radical>
    <components>
      <component>安</component>
      <component>木</component>
    </components>
  </character>
  <character>
    <symbol>舞</symbol>
    <pinyin>wǔ</pinyin>
    <meaning>to dance</meaning>
    <note/>
    <radical>舛</radical>
    <components>
      <component>舛</component>
      <component>卌</component>
      <component>一</component>
    </components>
  </character>
  <character>
    <symbol>決</symbol>
    <!-- <symbol>决</symbol> -->
    <pinyin>jué</pinyin>
    <meaning>to decide</meaning>
    <note/>
    <radical>水</radical>
    <components>
      <component>氵</component>
      <component>夬</component>
    </components>
  </character>
</characters>
